{
  "schema_version": "1.0",
  "roster_version": "2026.10.13",
  "as_of": "2026-10-13",
  "review_due_at": "2026-11-13",
  "scope": "Selected first-party API model candidates for agent-capable language work. Public documentation proves catalogue and list-price claims only; an exact executable route exists only in a private overlay and requires local validation.",
  "currency": "USD",
  "price_unit": "per_1m_tokens_unless_noted",
  "sources": [
    {"source_id": "openai-pricing", "publisher": "OpenAI", "url": "https://developers.openai.com/api/docs/pricing.md", "section": "Standard pricing data (including all models)", "claims": ["first-party model identifiers and standard token prices", "cache prices and pricing modifiers"], "accessed_at": "2026-10-13"},
    {"source_id": "openai-selection", "publisher": "OpenAI", "url": "https://developers.openai.com/api/docs/guides/model-selection", "section": "Model selection", "claims": ["official model-selection framing"], "accessed_at": "2026-10-13"},
    {"source_id": "anthropic-pricing", "publisher": "Anthropic", "url": "https://platform.claude.com/docs/en/about-claude/pricing.md", "section": "Model pricing", "claims": ["first-party standard token and cache prices", "route and geography pricing modifiers"], "accessed_at": "2026-10-13"},
    {"source_id": "anthropic-models", "publisher": "Anthropic", "url": "https://platform.claude.com/docs/en/models/overview.md", "section": "Compare models and legacy models", "claims": ["Claude API model identifiers and lifecycle", "official model capability summaries"], "accessed_at": "2026-10-13"},
    {"source_id": "anthropic-refusals", "publisher": "Anthropic", "url": "https://platform.claude.com/docs/en/build-with-claude/refusals-and-fallback", "section": "Refusals and fallback", "claims": ["Claude Fable 5.1, Fable 5, Opus 5.5, Opus 5, Sonnet 5.5 and Haiku 5.5 refusal response", "Haiku 5.5 has no server-side fallback or fallback credit"], "accessed_at": "2026-10-13"},
    {"source_id": "anthropic-retention", "publisher": "Anthropic", "url": "https://platform.claude.com/docs/en/manage-claude/api-and-data-retention", "section": "Model-specific data retention requirements", "claims": ["Covered Fable models 30-day retention and ZDR requirements"], "accessed_at": "2026-10-13"},
    {"source_id": "gemini-pricing", "publisher": "Google", "url": "https://ai.google.dev/gemini-api/docs/pricing", "section": "Gemini API pricing", "claims": ["paid-tier token prices", "grounding and cache pricing modifiers"], "accessed_at": "2026-10-13"},
    {"source_id": "gemini-models", "publisher": "Google", "url": "https://ai.google.dev/gemini-api/docs/models", "section": "Models", "claims": ["Gemini API model identifiers and lifecycle state"], "accessed_at": "2026-10-13"},
    {"source_id": "xai-pricing", "publisher": "xAI", "url": "https://docs.x.ai/developers/pricing", "section": "Text API", "claims": ["standard and long-context token prices", "server-side tool pricing modifiers"], "accessed_at": "2026-10-13"},
    {"source_id": "xai-models", "publisher": "xAI", "url": "https://docs.x.ai/developers/models", "section": "Models", "claims": ["xAI API model identifiers and context limits"], "accessed_at": "2026-10-13"}
  ],
  "candidates": [
    {
      "candidate_id": "openai/gpt-6-astra", "provider": "OpenAI", "model": "gpt-6-astra", "distribution_surface": "first_party_api", "status": "current", "access_state": "publicly_documented", "validation_state": "not_validated_by_agent_foundry", "billing_basis": "metered_tokens",
      "prices": {"input": 10.0, "cached_input": 1.0, "cache_write": 12.5, "output": 50.0, "notes": "Flagship Standard short context; >272k input tokens: 2x input/cache and 1.5x output for full request."},
      "best_fit": ["ambiguous high-stakes deliverables", "complex agentic work"],
      "strengths": ["highest published GPT-6 tier", "broad reasoning and tool surface"],
      "weaknesses": ["premium token price", "local suitability and entitlement untested"],
      "prompting_family": "openai-reasoning", "evidence": {"identity_and_price": "official", "suitability": "editorial"}, "source_ids": ["openai-pricing", "openai-selection"]
    },
    {
      "candidate_id": "openai/gpt-6.1-sol", "provider": "OpenAI", "model": "gpt-6.1-sol", "distribution_surface": "first_party_api", "status": "current", "access_state": "publicly_documented", "validation_state": "not_validated_by_agent_foundry", "billing_basis": "metered_tokens",
      "prices": {"input": 2.0, "cached_input": 0.1, "cache_write": 2.5, "output": 10.0, "notes": "Standard up to 272k input tokens; >272k: $4/$0.20/$5/$15 for full request. Fast/Ultrafast and residency cost more."},
      "best_fit": ["balanced production agents", "complex coding and synthesis where cost matters"],
      "strengths": ["newer Sol candidate", "lower cached input rate than GPT-6 Sol"],
      "weaknesses": ["exact-route suitability and entitlement untested", "long context and tools can dominate cost"],
      "prompting_family": "openai-reasoning", "evidence": {"identity_and_price": "official", "suitability": "editorial"}, "source_ids": ["openai-pricing", "openai-selection"]
    },
    {
      "candidate_id": "openai/gpt-6-sol", "provider": "OpenAI", "model": "gpt-6-sol", "distribution_surface": "first_party_api", "status": "current", "access_state": "publicly_documented", "validation_state": "not_validated_by_agent_foundry", "billing_basis": "metered_tokens",
      "prices": {"input": 2.0, "cached_input": 0.2, "cache_write": 2.5, "output": 10.0, "notes": "Still listed predecessor; Standard short context. >272k input tokens: 2x input/cache and 1.5x output for full request; Fast and residency cost more."},
      "best_fit": ["everyday coding and writing", "balanced agentic work"],
      "strengths": ["still-listed predecessor for existing workflows", "general-purpose reasoning"],
      "weaknesses": ["still requires exact-route evaluation", "tool fees and long context can dominate"],
      "prompting_family": "openai-reasoning", "evidence": {"identity_and_price": "official", "suitability": "editorial"}, "source_ids": ["openai-pricing", "openai-selection"]
    },
    {
      "candidate_id": "openai/gpt-6-luna", "provider": "OpenAI", "model": "gpt-6-luna", "distribution_surface": "first_party_api", "status": "current", "access_state": "publicly_documented", "validation_state": "not_validated_by_agent_foundry", "billing_basis": "metered_tokens",
      "prices": {"input": 0.1, "cached_input": 0.01, "cache_write": 0.125, "output": 0.5, "notes": "Flagship Standard short context; long context, Fast mode and residency can cost more."},
      "best_fit": ["bounded classification", "frequent scoped automations"],
      "strengths": ["low published token cost", "efficient GPT-6 option"],
      "weaknesses": ["lower ceiling for ambiguous work", "retries and tools can erase savings"],
      "prompting_family": "openai-reasoning", "evidence": {"identity_and_price": "official", "suitability": "editorial"}, "source_ids": ["openai-pricing", "openai-selection"]
    },
    {
      "candidate_id": "openai/gpt-5.6-sol", "provider": "OpenAI", "model": "gpt-5.6-sol", "distribution_surface": "first_party_api", "status": "current", "access_state": "publicly_documented", "validation_state": "not_validated_by_agent_foundry", "billing_basis": "metered_tokens",
      "prices": {"input": 4.0, "cached_input": 0.4, "cache_write": 5.0, "output": 20.0, "notes": "Cyber models, standard short context; promotional pricing at least through 2026-11-21. >272k input tokens: 2x input, 1.5x output for full request."},
      "best_fit": ["complex professional work", "large codebase reasoning", "high-stakes synthesis"],
      "strengths": ["high capability within GPT-5.6", "strong completion on complex multi-step work"],
      "weaknesses": ["expensive for routine or high-volume tasks", "long-context and service-tier multipliers can dominate cost"],
      "prompting_family": "openai-reasoning", "evidence": {"identity_and_price": "official", "suitability": "editorial"}, "source_ids": ["openai-pricing", "openai-selection"]
    },
    {
      "candidate_id": "openai/gpt-5.6-terra", "provider": "OpenAI", "model": "gpt-5.6-terra", "distribution_surface": "first_party_api", "status": "current", "access_state": "publicly_documented", "validation_state": "not_validated_by_agent_foundry", "billing_basis": "metered_tokens",
      "prices": {"input": 2.0, "cached_input": 0.2, "cache_write": 2.5, "output": 12.0, "notes": "Standard short context; >272k input tokens: 2x input and 1.5x output for full request; cache writes 1.25x input."},
      "best_fit": ["balanced daily agents", "production coding and analysis", "moderate-volume professional workflows"],
      "strengths": ["strong quality-cost balance", "broad general-purpose capability"],
      "weaknesses": ["not the cheapest route for bounded extraction", "still needs workload-specific completion and restraint evaluation"],
      "prompting_family": "openai-reasoning", "evidence": {"identity_and_price": "official", "suitability": "editorial"}, "source_ids": ["openai-pricing", "openai-selection"]
    },
    {
      "candidate_id": "openai/gpt-5.6-luna", "provider": "OpenAI", "model": "gpt-5.6-luna", "distribution_surface": "first_party_api", "status": "current", "access_state": "publicly_documented", "validation_state": "not_validated_by_agent_foundry", "billing_basis": "metered_tokens",
      "prices": {"input": 0.2, "cached_input": 0.02, "cache_write": 0.25, "output": 1.2, "notes": "Standard short context; >272k input tokens: 2x input and 1.5x output for full request; cache writes 1.25x input."},
      "best_fit": ["bounded high-volume workers", "classification and extraction", "cheap subagents with strong contracts"],
      "strengths": ["very low token cost", "useful member of the same GPT-5.6 family"],